11580,"ABFT for LGBTQ Suicidal Youth: Feasibility, Acceptability and Transportability","Postdoctoral Research Fellowship,http://afsp.org/wp-content/uploads/2016/11/Russon-Jody-2015.jpg,"Jody Russon, Ph.D.",Drexel University,,,,,2016,"Guy Diamond, Ph.D., Drexel University","Clinical Treatment Studies",,,104000,Inside the Research,"<strong>Question:</strong> Can Attachment Based Family Therapy (ABFT) be further modified for LGBT youth in a community mental health setting?<br /><br /><strong>Strategy:</strong> Using implementation science and working with community stakeholders, AFBT will be modified and pilot tested with LGBT suicidal youth.<br /><br /><strong>Impact:</strong> A portable, feasible intervention for suicidal LGBT youth and their families.",,,,
3627,Attentional Fixation as a Moderator of the Relation between Suicidal Ideation and Suicide Attempts,"Young Investigator Grant",http://afsp.org/wp-content/uploads/2016/01/Adler-Abby-2013.jpg,"Abby Adler, Ph.D.",University of Pennsylvania School of Medicine,,,,,2014,"Gregory Brown, Ph.D., University of Pennsylvania School of Medicine","Psychosocial Studies",,,85000,Inside the Research,"<strong>Bio:</strong> Dr. Adler received her Ph.D. in clinical psychology from Ohio State University in 2012. She is currently NRSA "Postdoctoral Research Fellowship Fellow at the Aaron T. Beck Psychopathology Research Center of the University of Pennsylvania.<br /><br /><strong>Research Categories:</strong> Psychosocial - assessment and risk<br /><br /><strong>Abstract: </strong>Suicidal ideation is a predictor of suicidal behavior and yet most people with suicidal ideation never make a suicide attempt. Dr. Adler examines how suicidal ideation shifts to suicidal behavior for some people. The study tests a key feature of the cognitive model of suicidal behavior, specifically that suicide attempts occur when suicidal ideation interacts with an attentional fixation on suicide, thus intensifying suicidal ideation until it reaches a threshold of intolerable emotional pain. Attentional fixation is a cognitive disturbance characterized by difficulty reasoning and difficulty disengaging attention away from suicide-relevant cues and can ultimately lead to a preoccupation with suicide as a solution to one’s problems. A total of 114 people will participate in the study: 57 being seen in the emergency department after attempting suicide; and 57 being seen in the emergency department for psychiatric reasons including suicidal ideation without a suicide attempt. Participants will complete an interview and a self-report measure of their suicidal thoughts, impulsivity, problem-solving behaviors, depression, anxiety and alcohol use. The contributions and differences among these variables will be compared between groups. Understanding how suicidal ideation shifts to suicidal behavior is critical for suicide prevention efforts.<br /><br /><strong>Impact: </strong>Interventions aimed at reducing attentional fixation, improving problem solving and shifting focus away from suicide.",,,,
11581,Blood-Brain Barrier in Suicide,"Postdoctoral Research Fellowship,http://afsp.org/wp-content/uploads/2016/11/Schnieder-Tatiana-2015.jpg,"Tatiana Schnieder, Ph.D.",Columbia University,,,,,2016,"Andrew Dwork, M.D., Columbia University","Neurobiological Studies","Genetic Studies",,104000,Inside the Research,"<strong>Question:</strong> Is the blood-brain barrier compromised in suicide?<br /><br /><strong>Strategy:</strong> Compare features of the blood-brain barrier that protects the brain in people who died by suicide with those with psychiatric disorders and nonpsychiatric controls, none of whom died by suicide.<br /><br /><strong>Impact:</strong> A marker of suicide risk that can be observed with conventional imaging techniques.",,,,
152930,Characterization of Rare Genetic Variants Involved in Risk of Death by Suicide,"Postdoctoral Research Fellowship,http://afsp.org/wp-content/uploads/2019/11/DiBlasi-Emily-2018.jpg,"Emily DiBlasi, Ph.D. ",University of Utah ,,,,,2018,"Hilary Coon, Ph.D.","Genetic Studies",,,112000,Grant Information,"The Utah Suicide Research Study, with its more than 4,300 individuals who died by suicide and a matched comparison group, provides a unique opportunity to identify rare genes that contribute to suicide and may not be identified in smaller studies. Knowledge about the contribution of genes to suicide can inform the development of medications that may aid in suicide prevention.",,,,
2474,Copy Number Variation in Suicide,"Young Investigator Grant",http://afsp.wpengine.com/wp-content/uploads/2016/01/Ernst-Carl-2010.jpg,"Carl Ernst, Ph.D.","Harvard University, Massachusetts General Hospital",,,,,2011,"Roy Perlis, M.D., Harvard University","Genetic Studies",,,85000,Inside the Research,"<strong>Bio:</strong> Dr. Ernst received his doctorate at McGill University in Montreal in 2009. He is currently a "Postdoctoral Research Fellowship fellow at Harvard Medical School and an associate member of the Broad Institute of MIT and Harvard.<br /><br /><strong>Research Categories:</strong> Genetics, bipolar disorder, major depression<br /><br /><strong>Abstract: </strong>Dr. Ernst is working to identify genetic risk factors for suicide by studying changes in gene structures known as copy number variations (CNV). DNA or gene structures vary from person to person as genes copy themselves. Over time, imperfections in this process, known as ""disruptions,"" can lead to large losses or increases in DNA. CNVs have been shown to be important, although uncommon, sources of risk for some psychiatric disorders. Dr. Ernst will examine the relationship between CNVs and suicide risk among individuals with bipolar and unipolar depression by comparing individuals with a history of suicide attempts and individuals without a history of a suicide attempt. His hypothesis is that those with a history of a suicide attempt will carry CNVs with 1) more disrupted genes; 2) larger disruptions; and 3) more possible problems in the way the genes are interpreted in the brain. In addition, he will examine whether CNV disruptions found in people who have made suicide attempts are also found in people who died by suicide. The mentorship goal is to develop skills to understand the genetic risk for suicide, with an emphasis on the association between CNVs and suicide.<br /><br /><strong>Impact:</strong> To increase our understanding of the genetics of suicide in order to inform the development of treatments to prevent suicide.",,,,
3628,"Direct Electrical Stimulation of the Amygdala: Impact on Suicidal Ideation, Depression, and Anxiety","Young Investigator Grant",http://afsp.org/wp-content/uploads/2016/01/Bijanki-Kelly-2013.jpg,"Kelly Bijanki, Ph.D.",University of Iowa Carver College of Medicine,,,,,2014,"Jess Fiedorowicz, M.D., Ph.D., University of Iowa Carver College of Medicine","Neurobiological Studies","Clinical Treatment Studies",,39866,Inside the Research,"<strong>Bio:</strong> Dr. Bijanki-Rowe received her Ph.D. in neuroscience from the University of Iowa in 2011. She is currently a "Postdoctoral Research Fellowship Fellow in the Department of Psychiatry at Emory University School of Medicine, as well as an Adjunct Research Assistant Professor in the Department of Neurosurgery at University of Iowa Carver College of Medicine.<br /><br /><strong>Research Categories:</strong> Neurobiological, clinical treatment<br /><br /><strong>Abstract: </strong>The amygdala, an almond-shaped structure in the brain, plays a key role in anxiety and depression, two key underpinnings of suicide. The proposed study aims to model the neurobiological mechanisms at the intersection of anxiety and depression, and is only possible because in some cases, patients with intractable epilepsy require the surgical implantation of electrodes in the amygdala in order for surgeons to identify the brain region responsible for producing seizures. These electrodes will be used to record local neuronal activity and to deliver small electrical currents to the amygdala to study its function in relation to suicidal thoughts, general mood, and anxiety.  Each participant will be assessed at baseline with measures of depression, anxiety, and suicidal thinking. The participants will then be asked to complete two tasks; one task will be to rate their current mood and the next task will be to rate the happiness or sadness of facial expressions shown on a computer. Both of these tasks will be administered under two conditions, once with stimulation of the amygdala and once without. During both of these tasks Dr. Bijanki-Rowe’s team will record activity of the amygdala neurons, rates of the participants’ respiration, heartbeat, and skin conductance, all considered  markers of anxiety and negative mood. The study examines the neurological basis for suicidal thoughts.<br /><br /><strong>Impact:</strong> Greater understanding of the neurobiological mechanisms of suicide for the development of interventions.",,,,
2561,Emotion Dysregulation as a Potential Mechanism of the Relation between Anxiety and Suicide Attempts,"Young Investigator Grant",,"Shari Jager-Hyman, Ph.D.",University of Pennsylvania School of Medicine,,,,,2013,"Gregory Brown, Ph.D., University of Pennsylvania School of Medicine","Psychosocial Studies","Clinical Treatment Studies",,85000,Inside the Research,"<strong>Bio:</strong> Dr. Jager-Hyman received her doctorate from Temple University in 2012. She is currently an NRSA "Postdoctoral Research Fellowship Fellow at the University of Pennsylvania School of Medicine.<br /><br /><strong>Research Categories:</strong> Psychosocial studies; clinical trial studies<br /><br /><strong>Abstract: </strong>Anxiety has been found to be related to suicide attempt risk. Emotion dysregulation, which refers to maladaptive ways of dealing with one’s emotions, is a common symptom of a person who has anxiety. Dr. Jager-Hyman’s study seeks to advance our understanding of the relationship between anxiety and suicide attempts, especially in patients who visit the psychiatric emergency department (ED). This study will also take a look at the association between emotion dysregulation and suicidal risk. The sample will consist of 50 participants visiting an ED following a suicide attempt in the previous 48 hours and 50 people presenting to the ED for psychiatric concerns in the absence of a suicide attempt. Participants will complete a clinical interview assessing history of suicidal thoughts and behaviors, along with self-report measures assessing anxiety and depression. Also, the <em>Difficulties in Emotion Regulation Scale, </em>a computer-based behavioral measure of emotion dysregulation, will be used. Findings from this study will help to further explain the association between anxiety and suicide attempts with an emphasis on those who are seen in emergency departments.<br /><br /><strong>Impact: </strong>This study has potential to find a process that explains the anxiety-suicide attempt relationship, which will enable providers to tailor prevention and intervention efforts to address emotion regulation deficits.",,,,
6394,Epigenetic Regulation of the Amygdala by Child Abuse and Suicide,"Postdoctoral Research Fellowship,http://afsp.org/wp-content/uploads/2016/04/Photo-PE-Lutz_AFSP.jpg,"Pierre-Eric Lutz, M.D., Ph.D.",McGill University,,,,,2014,"Gustavo Turecki, M.D., Ph.D., McGill University","Genetic Studies",,,104000,Inside the Research,"<strong> Question:</strong> Does gene function in the amygdala explain how child abuse can trigger suicide?<br /><br /><strong>Strategy:</strong> Characterize genetic expression in the amygdala and blood of people with histories of aggression and severe child abuse who died by suicide and nonpsychiatric controls.<br /><br /><strong>Impact:</strong> Identify pathways genetically induced by child abuse and propose avenues for intervention.",,,,
3622,Examining the Neurobiology of Suicidal Behavior in Adolescents,pilot,http://afsp.org/wp-content/uploads/2016/01/Glenn-Catherine-2013.jpg,"Catherine Glenn, Ph.D.",Harvard University,,,,,2014,,"Neurobiological Studies","Psychosocial Studies",,29840,Inside the Research,"<strong>Bio:</strong> Dr. Glenn received her Ph.D. in clinical psychology from Stony Brook University in 2012. She is currently a NIMH "Postdoctoral Research Fellowship Fellow at Harvard University.<br /><br /><strong>Research Categories:</strong> Neurobiological - brain functioning, Psychosocial<br /><br /><strong>Abstract: </strong>The rate of suicidal behavior begins to increase during adolescence and this may be related to developmental changes in neurobiology and brain function at that time. Key neurobiological changes take place during adolescence: the subcortical brain region matures early, which relates to a person’s reward-focused behavior, while prefrontal systems in the brain are also still developing, which relates to behavioral control. In short, adolescents have too much ‘acceleration’ in without fully functioning ‘brakes’ in behavior.  This neurobiological model can explain to risk-taking behavior in these adolescents with depression. To increase our understanding of the relationship between brain development and suicidal behavior, Dr. Glenn will assess 40 adolescent females with major depression who are aged 13-17 years old, half of whom will have mad suicide attempt within the last year and half who report no history of suicidal ideation or suicide attempts. Functional magnetic resonance imaging (fMRI) will be used to measure brain function during tasks related to risk-taking and behavioral inhibition and control.  In addition, self-report measures will be administered to assess suicidal ideation and behavior as well as impulsiveness. The goal is to gain understanding about adolescents who are suicidal and have difficulty weighing reactivity to reward when they need to restrain their behavior.<br /><br /><strong>Impact:</strong> Understanding of the neurobiological that may underlie suicidal behavior specifically in adolescents.",,,,
6404,Grief Process and Neural Circuitry in Families After a Suicide,"Young Investigator Grant",http://afsp.org/wp-content/uploads/2016/04/Schneck-Noam-2013.jpg,"Noam Schneck, Ph.D.",Columbia University,,,,,2014,"J. John Mann, M.D., Columbia University","Neurobiological Studies",,,85000,Inside the Research,"<strong>Bio:</strong> Dr. Schneck received his Ph.D. in psychology from Fairleigh Dickinson University in 2014. He is currently a "Postdoctoral Research Fellowship fellow at Laboratory for Intelligent Imaging and Neural Computing at Columbia University.<br /><br /><strong>Grant Categories:</strong> Psychosocial studies, assessment and risk studies<br /><br /><strong>Abstract: </strong>Suicide related grief (SRG) is linked to heightened risks for future suicidal ideation and behavior and psychiatric complications. Processing grief is an important process after a loss. Avoidance in addressing the loss complicates necessary grief-related processing. In contrast, yearning for the bereaved allows for exposure to memories of the deceased and leads to acceptance of the loss. Furthermore, several theories of bereavement have suggested that rigidity in any type of grief style also confers risk for subsequent mental health problems. Dr. Schneck will use a functional magnetic resonance imaging (fMRI) task and measure yearning, avoidance, rigidity and acceptance in 30 people with suicide related grief as compared to 15 people with non-suicide related grief. He hypothesizes that the groups will differ in terms of yearning, avoidance, rigidity and acceptance and that neural markers will be related to changes that occur during the grief process. Participants will be assessed shortly after their loss and again six months later. In addition to assessing yearning, avoidance, rigidity and acceptance, an emotional Stroop Test and continuous memory induction task about their loved one will be administered to elicit these behaviors during each fMRI scan.<br /><br /><strong>Impact: </strong>Increased understanding of suicide related grief leading to interventions to facilitate the grief process.",,,,
152931,Individual and Contextual Level Correlates of Suicide in Rural Areas of the United States,"Postdoctoral Research Fellowship,http://afsp.org/wp-content/uploads/2019/11/Steelesmith-Danielle-2018.jpg,"Danielle Steelesmith Ph.D., M.S.W. ",Ohio State University,,,,,2018,"Cynthia Fontanella, Ph.D.","Psychosocial Studies",,,111999,Grant Information,"Potential risk factors for suicide among rural residents include social isolation and loneliness, access to lethal means, and lack of mental health care. Individual and community factors associated with suicide risk within rural areas can be identified by combining and analyzing large data sets, such as the American Community Survey, Area Health Resource File, Community Business Patterns, and mortality files. With the high rate of suicide in rural areas, we need more research.",,,,
3629,Investigating HTR1A Transcription as a Mechanism Underlying Suicide Risk,"Young Investigator Grant",http://afsp.org/wp-content/uploads/2016/01/Donaldson-Zoe-2013.jpg,"Zoe Donaldson, Ph.D.",Research Foundation for Mental Health/Columbia University,,,,,2014,"Victoria Arango, Ph.D., Columbia University and New York State Psychiatric Institute","Neurobiological Studies","Genetic Studies","Psychosocial Studies",85000,Inside the Research,"<strong>Bio:</strong> Dr. Donaldson received her Ph.D. in neuroscience from Emory University in 2009. She is currently a "Postdoctoral Research Fellowship Fellow in affective disorders training at Columbia University.<br /><br /><strong>Research Categories:</strong> Genetic, neurobiological - postmortem animal studies, psychosocial, assessment and risk studies.<br /><br /><strong>Abstract: </strong>Suicide is a complex behavior often triggered by exposure to stressful events, and further influenced by biological predispositions. Dr. Donaldson builds upon previous research to explain how stressful experiences interact with genetics to impact brain activity and risk for suicidal behavior. This study examines the effects of both genetic and environmental impact on the functioning of a serotonin gene which has been extensively linked with suicide. The study will use both post-mortem human brain tissue, as well as a humanized mouse model, to examine the relationship among stress, genetic variation/expression, and suicide. Dr. Donaldson will investigate the direct effects of variation in serotonin that are important predictors of suicidal behavior which is modeled in mice by measuring aggression, impulsivity, and decreased social engagement. The role of adversity will also be examined as a risk factor for behaviors considered as markers for suicidal behavior, to see if a history of significant stress interacts with genetic variation in relation to these proxy behaviors.<br /><br />The study’s dual approach, i.e. post-mortem brain tissue and animal behavior, leverages the validity of working with human tissue while also taking advantage of the strengths of a unique animal model to determine causal relationships. This work facilitates the future development of targeted interventions and therapeutics by providing a mouse model for testing pharmacogenetic treatment pathways and may provide guidance for predicting individualized treatment outcome.<br /><br /><strong>Impact: </strong>Personalized treatment to reduce suicide risk.",,,,
3659,Safety Planning with Motivational Interviewing for Healthy Coping (MI-SafeCope),"Postdoctoral Research Fellowship,http://afsp.org/wp-content/uploads/2016/01/Czyz-Ewa-2014.jpg,"Ewa Czyz, Ph.D.",University of Michigan,,,,,2015,"Cheryl King, Ph.D., University of Michigan","Psychosocial Studies","Clinical Treatment Studies",,104000,Inside the Research,"<strong>Question:</strong> Will a brief inpatient intervention for teens and their families prevent suicidal behavior?<br /><br /><strong>Strategy:</strong> Adolescents hospitalized for a suicide attempt and their families will receive motivational interviewing, safety planning and a post-discharge phone session. Coping, suicidal ideation and mood are assessed over 3 months.<br /><br /><strong>Impact:</strong> An intervention to prevent repeat suicidal behavior among adolescents.",,,,
2484,Self Harm &amp; Suicide Attempt Risk: Evaluation of an Intervention for Youths with Self-Harm Behavior,"Young Investigator Grant",http://afsp.wpengine.com/wp-content/uploads/2016/01/Hughes-Jennifer-2011.jpg,"Jennifer L. Hughes, Ph.D.","University of California, Los Angeles",,,,,2012,"Joan R. Asarnow, Ph.D., University of California, Los Angeles","Clinical Treatment Studies",,,85000,Inside the Research,"<strong>Bio: </strong>Dr. Hughes received her doctorate from the University of Texas Southwestern Medical Center in 2010. She is currently a "Postdoctoral Research Fellowship Scholar in the Youth Stress and Mood Program at the Semel Institute of Neuroscience and Human Behavior at the University of California, Los Angeles.<br /><br /><strong>Research Categories:</strong> Intervention for youth who have made a suicide attempt and their family.<br /><br /><strong>Abstract: </strong>Clinicians need more information about the links between non-suicidal self-injury (NSSI) and suicidal behavior, and effective interventions for addressing NSSI in adolescents. Dr. Hughes will use an intervention for adolescent suicide attempters called the Safe Alternatives for Teens and Youth (SAFETY), adapting it specifically for youth presenting with NSSI. She will test the adapted SAFETY intervention by randomly assigning 30 treatment-seeking youth with significant self-harm behavior to receive Enhanced Treatment As Usual (Enhanced TAU) vs. SAFETY. Youth and families in the SAFETY group will receive weekly intervention sessions for three months. The SAFETY intervention aims to reduce the risk of suicide attempts by targeting individual and environmental risk and protective factors using a cognitive behavioral approach. Youth and families in the Enhanced TAU group will receive one intervention session targeted at enhancing safety, reducing self-harm and suicide risk, and highlighting the importance of outpatient treatment to address NSSI and any psychiatric symptoms. They will also receive monthly check-ins to encourage linkage to community care. Outcomes will be assessed at three and six months. Dr. Hughes predicts that the SAFETY intervention will be feasible, tolerable, acceptable, and safe. In addition, she predicts that the rate of repeat NSSI will be lower in the SAFETY group compared with the Enhanced TAU group at the three-month assessment.<br /><br /><strong>Impact:</strong> To gain insight into the relationship between NSSI and suicidal behavior in youth, identify risk and protective factors, and develop targeted interventions.",Research Connection,"<a href=""http://afsp.org/safety-program-family-intervention-emergency-departments/"">Click here to read Dr. Hughes's Research Connection.</a>",,
2483,The Electronic Intervention for Suicidality (EIS): A Novel Adjunctive Treatment for Suicide Risk,"Young Investigator Grant",http://afsp.wpengine.com/wp-content/uploads/2016/01/Armey-Michael-2011.png,"Michael Armey, Ph.D.",Butler Hospital,,,,,2012,"Ivan Miller, Ph.D., Butler Hospital","Clinical Treatment Studies",,,84027,Inside the Research,"<strong>Bio:</strong> Dr. Armey received his doctorate at Kent State University in 2009. He is currently a "Postdoctoral Research Fellowship fellow at Butler Hospital and Brown University School of Medicine.<br /><br /><strong>Research Categories:</strong> Intervention and treatment development for people who have made suicide attempts<br /><br /><strong>Abstract:</strong> Imagine an individualized approach to suicidal ideation where a person who is struggling can use the internet and a smartphone to help him or her through a difficult moment. Dr. Armey is working to develop an acceptable and feasible add-on to interventions for suicidal ideation using a combination of internet-based interactive educational modules and adaptive, smartphone-delivered, interventions. His study is aimed at refining the Electronic Intervention for Suicidality (EIS) treatment manual, software, and website. Treatment development involves a two-wave assessment of the intervention program. A small sample of adults who recently attempted suicide will participate after their discharge from the hospital. They will use the interactive internet modules and smartphone interventions to provide feedback to the researcher regarding suicidal ideation, urges, and hospitalization. Feasibility and acceptability of the interventions will be assessed and the program will be improved as a result of this process. Electronic aids may provide a suitable approach to engaging and helping people who have suicidal ideation and a history of suicide attempt.<br /><br /><strong>Impact:</strong> Development of accessible, effective, personalized computer-adaptive interventions to supplement treatment for individuals with suicidal ideation and risk.",,,,
