11579,The Relationship Between Decision-Making In a Negative Environment and Suicidal Behaviors,"Postdoctoral Research Fellowship,http://afsp.org/wp-content/uploads/2016/11/Millner-Alexander-2015.png,"Alexander Millner, Ph.D.",Harvard University,,,,,2016,"Matthew Nock, Ph.D., Harvard University","Psychosocial Studies",,,104000,Inside the Research,"<strong>Question:</strong> How do the ways people make decisions relate to suicidal behavior?<br /><br /><strong>Strategy:</strong> Participants complete two novel tasks assessing decision-making, and escape behaviors under aversive contexts. Individuals with suicidal ideation are compared to those who have made a suicide attempt.<br /><br /><strong>Impact:</strong>  Understanding the role of decision-making in suicidal behavior. ",,,,
29577,The Role of Social Media in Adolescents’ Suicidal Thoughts and Behavior,"Postdoctoral Research Fellowship,http://afsp.org/wp-content/uploads/2018/11/Nesi-Jacqueline-2017.jpg,"Jacqueline Nesi, Ph.D.",Brown University,,,,,2018,"Anthony Spirito, Ph.D., Brown University","Psychosocial Studies",,,104000,Inside the Research,"<strong>Question: </strong>How do online peer experiences affect risk for suicidal behavior among female adolescents?<br /><br /><strong>Strategy: </strong>Seventy adolescents identifying as female from the inpatient psychiatric unit at Brown-affiliated Bradley Hospital will participate.  Online peer experiences of adolescents who have attempted suicide will be compared with teen girls with suicidal ideation who have not attempted suicide.  A multi-method assessment that includes qualitative and semi-structured interviews and surveys and social media data will be studied.<br /><br /><strong>Impact: </strong>Identification of novel targets for suicide prevention efforts among female adolescents.",,,,
18638,Trajectories of Methods Used by Frequent Repeaters of Non-Fatal Self-Harm: Associations with Suicide,"Postdoctoral Research Fellowship,http://afsp.org/wp-content/uploads/2017/10/Witt-Katrina-2016.jpg,"Katrina Witt, Ph.D.",Monash University Turning Point Eastern Health Clinical School (Australia),,,,,2017,"Dan Lubman, Ph.D., Monash University (Australia)","Psychosocial Studies",,,104000,Inside the Research,"<strong>Question: </strong>Does method of self-harm behavior tell us something about suicide risk?<br /><br /><strong>Strategy: </strong>Ambulance and coroner data in Australia will be combined to examine pathways from repeated self-harm behavior to death by suicide. Particular attention will be paid towards method of self-harm and substance use.<br /><br /><strong>Impact: </strong>Improved understanding of pathways to suicide deaths.",,,,
3660,Transitions from Suicidal Thoughts/Non-Suicidal Self-Harm to Suicide Attempts: A Longitudinal Study,"Postdoctoral Research Fellowship,http://afsp.org/wp-content/uploads/2016/01/Mars-Becky-2014.jpg,"Becky Mars, Ph.D.",University of Bristol,,,,,2015,"David Gunnell, Ph.D., University of Bristol","Psychosocial Studies",,,104000,Inside the Research,"<strong>Question:</strong> How do suicidal ideation and self-harm behavior transition to suicidal behavior?<br /><br /><strong>Strategy:</strong> Using the Avon Longitudinal Study of Parents and Children, adolescents ages 16 to 21 are studied. Variables include suicidal ideation, self-harm behavior and associated risk factors.<br /><br /><strong>Impact:</strong> Inform concepts of the transition from ideation and self-harm to suicidal behavior.",,,,
6403,Using Text Messages to Predict Depression and Suicidal Behavior Among LGBT Individuals,"Young Investigator Grant",http://afsp.org/wp-content/uploads/2016/04/Lytle-Flint-Megan-2013.jpeg,"Megan Lytle, Ph.D.",University of Rochester Medical Center,,,,,2014,"Vincent Silenzio, M.D., MPH, University of Rochester Medical Center","Psychosocial Studies",,,85000,Inside the Research,"<strong>Bio:</strong> Dr. Lytle received her Ph.D. in counseling psychology from Seton Hall University in 2012. She is currently a "Postdoctoral Research Fellowship Research Fellow at the University of Rochester.<br /><br /><strong>Grant Categories:</strong> Psychosocial studies, assessment and risk studies<br /><br /><strong>Abstract:</strong> The lesbian, gay, bisexual, and transgender (LGBT) community is found to be twice as likely to report having attempted suicide as their non LGBT peers. LGBT youth also tend to have less social well-being than LGBT adults so they tend to create their own online communities to enhance their social capital. Social well-being and connectivity is highly associated with being a protective factor against suicidal behavior. Dr. Lytle’s study uses machine learning statistical models to analyze linguistic (i.e., language) data from text messages to predict suicidal behavior. Data from the Trevor Project’s TrevorText over 100,000 anonymous members’ text messages will be analyzed. The study will examine the data and create a language model in order to detect variables that are prevalent in the LGBT community that are associated to suicidal risk such as, isolation, cultural factors, impulsivity, hopelessness, and stress. Ultimately this “machine” or model will learn to classify visitors as suicidal or non-suicidal. Dr. Lytle’s model will also analyze other important variables including the volunteers who work with TrevorText and common theories of suicide, such as Durkheim’s. The LGBT community has been shown to get involved with online communities and this research will include people who are struggling  and yet would not typically seek out help in person.<br /><br /><strong>Impact:</strong> Enhancement of current suicide prevention hotlines, augmentation of outreach programs and the development of culturally informed technological suicide prevention interventions, especially for LGBT individuals.",,,,
2467,White Matter Integrity and Suicide Attempt History,"Postdoctoral Research Fellowship,http://afsp.wpengine.com/wp-content/uploads/2016/01/Olvet-Doreen-2010.jpg,"Doreen Olvet, Ph.D.",State University of New York (SUNY) Stony Brook,,,,,2011,"Ramin Parsey, M.D., Ph.D., SUNY Stony Brook","Neurobiological Studies",,,100000,Inside the Research,"<strong>Bio:</strong> Dr. Olvet received her doctorate at Stony Brook University in 2009. She has been performing her "Postdoctoral Research Fellowship research at North Shore Long Island Jewish Health System.<br /><br /><strong>Research Category:</strong> Brain imaging<br /><br /><strong>Abstract: </strong>The fibers in the brain’s white matter serve as information networks for sending messages throughout the brain. Their structure and functioning may relate to impulsiveness, as well as to suicide intent and lethality in people who have made a suicide attempt. Dr. Olvet will use an imaging technique called Diffusion Tensor Imaging (DTI) to discover how the structural integrity of white matter cells in the brain differs among three groups of participants: depressed individuals who have made a suicide attempt, depressed individuals who have not attempted suicide, and individuals with no psychiatric history. Dr. Olvet expects to find that individuals with a history of suicide attempts will have less white matter integrity than those who have not attempted suicide. She will also attempt to identify specific paths, or tracts, that might play a role in suicidal behavior.<br /><br /><strong>Impact:</strong> To help identify individuals at risk for suicide by discovering differences in the brains of people with and without a history of suicide attempts.",,,,